title,day,time,full_time,organizer,num_comments,url,description,comment
"Meet and Eat",3,"6:00 pm","June 3, 2013 @ 6:00 pm – 7:30 pm",kh928,88,http://itp.nyu.edu/camp2013/ai1ec_event/camp-kick-off/?instance_id=486,"Time to kick off camp! Join us for some snacks and getting to know your fellow campers!","This summer is gonna rock!"
"From Story to Tech: a methodology project",17,"7:00 pm","June 17, 2013 @ 7:00 pm – 9:00 pm",kh928,31,http://itp.nyu.edu/camp2013/ai1ec_event/from-story-to-tech-a-methodology-project/?instance_id=345,"Often times, it seems that tech projects can come off as nothing more than technological masturbation. Many of us know what it&#8217;s like to witness a new project with cutting-edge tech only to feel disappointed, likening the experience more to a technical demo than something poignant and worth remembering. This may happen with projects of any nature, of course, but tech projects are especially prone to the pitfall of gadgetry taking precedence over meaning.","I&#8217;ll be there!"
"Making Things Move with Arduino",18,"5:00 pm","June 18, 2013 @ 5:00 pm – 7:30 pm",dagimage,14,http://itp.nyu.edu/camp2013/ai1ec_event/making-things-move-with-arduino/?instance_id=1088,"Want to make things move with an Arduino?  Let&#8217;s look at how we control motors, and how we design and make the gears that will let the motors move things.  Note: the first half will be dedicated to controlling motors the second half will cover gears.","looks great"
"Making Things Move with Arduino",18,"5:00 pm","June 18, 2013 @ 5:00 pm – 7:30 pm",dagimage,14,http://itp.nyu.edu/camp2013/ai1ec_event/making-things-move-with-arduino/?instance_id=1088,"Want to make things move with an Arduino?  Let&#8217;s look at how we control motors, and how we design and make the gears that will let the motors move things.  Note: the first half will be dedicated to controlling motors the second half will cover gears.","i&#8217;ll be there for the first hour"
"Wearable and Mobile Accessories",18,"6:00 pm","June 18, 2013 @ 6:00 pm – 8:00 pm",savanevery@gmail.com,26,http://itp.nyu.edu/camp2013/ai1ec_event/wearable-and-mobile-accessories/?instance_id=1092,"Kate Hartman and Shawn Van Every will give a tour through some of the recent wireless and wearable platforms and products that are emerging and give a workshop on how we might prototype some ideas of our own.","i&#8217;ll be there"
"Breadboard Analog Synthesizer Workshop",20,"3:00 pm","June 20, 2013 @ 3:00 pm – 4:00 pm","David Rios",3,http://itp.nyu.edu/camp2013/ai1ec_event/breadboard-analog-synthesizer-workshop/?instance_id=1063,,"I&#8217;ll be here, but is it 2pm or 3pm? The bigscreen says 2pm&#8230;"
