title,day,time,full_time,organizer,num_comments,url,description,comment
"Mobile Storytelling as a New Medium",5,"8:00 pm","June 5, 2013 @ 8:00 pm – 9:00 pm",lia.martinez@nyu.edu,51,http://itp.nyu.edu/camp2013/ai1ec_event/mobile-storytelling-as-a-new-medium-2/?instance_id=174,"Mobile Storytelling as a New Medium is the first installment of a 3 part series on creating narratives within in the framework of a app. This lecture is a survey of current artists and projects using the mobile platform to create innovative narrative forms (i.e: Christoph Niemann’s “Petting Zoo”,  David Benqué’s “The Infinite Adventure Machine”, Works from “Les Editions Volumiques” etc…).","attending, thank you"
"ITP Mappathon: Content Making for Projection Mapping",6,"4:00 pm","June 6, 2013 @ 4:00 pm – 6:00 pm",chiklet@gmail.com,51,http://itp.nyu.edu/camp2013/ai1ec_event/2252-2/?instance_id=231,"Step 1
 This week, we will learn how to make visual content using Modul8.
 We will use a png, a jpg and a movie files to make a moving image using Modul8. This method is a great tool to camp your idea.",attending!
"Acrylic Cutting and Bending",7,"10:30 am","June 7, 2013 @ 10:30 am – 11:30 am","Ben Light",28,http://itp.nyu.edu/camp2013/ai1ec_event/acrylic-cutting-and-bending/?instance_id=361,"Learn a fast and easy way to prototype precision parts using the laser cutter.  And then literally take it in a new direction with the acrylic bender.  Quickly turn 2D parts into 3 dimensional objects.","sounds great!"
"Early version &#8211; From Story to Tech: a methodology project",7,"12:30 pm","June 7, 2013 @ 12:30 pm – 2:30 pm","JC Nesci",15,http://itp.nyu.edu/camp2013/ai1ec_event/3106-2/?instance_id=790,"Advanced, earlier date of my presentation on the 17th for those of you who wish to get ideas for your Camp projects a little sooner.",attending!
"Hello PhoneGap",8,"1:00 pm","June 8, 2013 @ 1:00 pm – 4:00 pm",unknownbot01@gmail.com,37,http://itp.nyu.edu/camp2013/ai1ec_event/hello-phonegap/?instance_id=149,"The miracle of mobile computing has arrived. Exceedingly powerful computers, seamlessly networked and with a variety of in-built sensors&#8230; all right in your pocket.PhoneGap is an open source framework that lets you program cross-platform mobile phone apps using HTML, Javascript and CSS. Providing a Javascript API to access  the accelerometer, GPS, notifications, and other hardware capabilities of your phone, you can write your code once and deploy the app to Android, iPhone, Blackberry and several other platforms.","attending! thank you."
"Intro to PhoneGap and NFC",13,"6:30 pm","June 13, 2013 @ 6:30 pm – 8:30 pm",ti8,17,http://itp.nyu.edu/camp2013/ai1ec_event/intro-to-phonegap-and-nfc/?instance_id=552,"So you already went to Sean Montgomery&#8217;s session, &#8220;Hello PhoneGap&#8221; last week, or maybe you didn&#8217;t.  But you know what HTML is, and you know a little JavaScript, and you&#8217;re thinking, &#8220;Gee, I wish I could develop mobile apps that use Near Field Communication on Android!&#8221;  Yep, this session is for you.",Yes!
"UX Skill &#8211; Responsive Design Process",14,"6:30 pm","June 14, 2013 @ 6:30 pm – 7:30 pm",dkawasaki@gmail.com,38,http://itp.nyu.edu/camp2013/ai1ec_event/ux-skill-responsive-design-process/?instance_id=1016,"Do you create UX documents in Omnigraffle, Visio, InDesign, Axure or Illustrator?  Does the design team still create Photoshop PSD files to hand off to the developer?  That no longer works in the responsive design world we live in.","I have been waiting all my life for this."
"ITP Thesis Spotlight",17,"6:30 pm","June 17, 2013 @ 6:30 pm – 8:00 pm","Crys Moore",4,http://itp.nyu.edu/camp2013/ai1ec_event/itp-thesis-spotlight/?instance_id=1064,&nbsp;,attending&#8230;
