title,day,time,full_time,organizer,num_comments,url,description,comment
"Meet and Eat",3,"6:00 pm","June 3, 2013 @ 6:00 pm – 7:30 pm",kh928,88,http://itp.nyu.edu/camp2013/ai1ec_event/camp-kick-off/?instance_id=486,"Time to kick off camp! Join us for some snacks and getting to know your fellow campers!","See y&#8217;all there."
"Shop Safety!",4,"5:00 pm","June 4, 2013 @ 5:00 pm – 6:00 pm","Crys Moore",13,http://itp.nyu.edu/camp2013/ai1ec_event/shop-safety-3/?instance_id=613,"Get Shop certified!","I&#8217;m in for 5 pm Tuesday."
"Intro to Kinect &amp; Processing",11,"6:00 pm","June 11, 2013 @ 6:00 pm – 8:00 pm","Crys Moore",26,http://itp.nyu.edu/camp2013/ai1ec_event/intro-to-kinect-processing/?instance_id=908,"more to come but&#8230;",Attending
"XBee Basics Workshop",15,"1:00 pm","June 15, 2013 @ 1:00 pm – 2:00 pm",erin@erinlewis.ca,17,http://itp.nyu.edu/camp2013/ai1ec_event/xbee-basics-workshop/?instance_id=976,"Learn the basics of XBee wireless communication with 802.15.4 (Series 1) radios. We’ll demystify the various different types of radios and wireless networks, work through a basic wireless serial connection and talk about direct pin access. I’ll provide loaner XBees, but if you’d like to bring your own, we’ll be using XBee Series 1 with Sparkfun’s XBee explorer. Also, please download Coolterm and FTDI drivers if you haven’t already.",Attending
"Introduction to Distributed Sensor Networks",15,"2:00 pm","June 15, 2013 @ 2:00 pm – 6:00 pm","Alasdair Allan",41,http://itp.nyu.edu/camp2013/ai1ec_event/introduction-to-distributed-sensor-networks/?instance_id=993,"Sensors are the future of distributed data. General-purpose computing is dissipating and becoming increasingly embedded into our lives. We will soon begin to move in a sea of data, our movements monitored and our environments measured and adjusted to our preferences, without need for direct intervention.","I&#8217;m going."
"Tom Igoe Mystery Talk",24,"7:30 pm","June 24, 2013 @ 7:30 pm – 9:00 pm","Crys Moore",27,http://itp.nyu.edu/camp2013/ai1ec_event/tom-igoe-mystery-talk/?instance_id=1000,&nbsp;,"Attending. I don&#8217;t know about topics. I like JC&#8217;s. Also:
 How Tom Igoe Became Tom Igoe
 Citizen Scientists/Crowd-Sourced Science/DIY Science
 What&#8217;s the Next Exciting Thing in P Comp, beyond Arduino/RaspPI/3-D print+scan?"
